September 27, 2016	USA TODAY	Provocative Trump, who unexpectedly claimed the Republican presidential nomination over a dozen rivals with stronger political résumés? Or Presidential Trump, who in recent weeks has toned down his rhetoric and, in another political surprise, managed to pull even with rival Hillary Clinton in national and battleground polls? In response to the opening question, Trump repeated his signature, dire view of the state of the nation. "We have to stop our jobs from being stolen from us," he said, decrying the threat from Mexico and China. "We have to stop our jobs from leaving the United States and with it firing all our people."  Clinton's response to the first question reflected her signature devotion to policy, working in bullet-point references to infrastructure investment, a higher minimum wage, equal pay for women, profit-sharing for workers, paid family leave, earned sick days, affordable child care and debt-free college. Later, she said, "Donald thinks climate change is a hoax perpetrated by the Chinese; I think it's real." Trump protested she was wrong, although he tweeted exactly that. And within minutes, they were interrupting one another and talking over one another. The setting inside the debate hall at Hofstra University looked dignified enough to fit in the White House itself, with a dark blue backdrop, a discrete band of white stars and a depiction of a golden eagle soaring over the two contenders. But the mood surrounding the opening forum was almost gladitorial, reaching Super Bowl-size levels of hype. No presidential election in modern times has defied the conventional wisdom as much this one, which has ended up pitting a political neophyte and reality-TV star against the wife of a former president, a member of the family that defines the Democratic establishment. And no presidential debate in the television age has been more hotly anticipated. They walked out from opposite sides of the stage, Clinton in a red jacket and slacks, Trump in a gray suit and bright blue tie. They shook hands, greeted the moderator, and retreated to the podiums. A few hours before the debate, Trump did needle Clinton on Twitter, a platform he has perfected as a political weapon. "My team of deplorables will be managing my Twitter account for this evenings debate," he wrote, a reference to her description at a fundraiser of his followers as a "basket of Deplorables." Those jibes might not seem to have set the landscape for a debate focused on the challenge of overhauling America's tax system or the imperative to devise fresh approaches to the civil war in Syria. Indeed, much of the attention was focused on whether Trump could project restraint for a full 90 minutes, and whether Clinton convincingly could convey a sense of trustworthiness. History demonstrates that the opening debate can be powerful enough to boost a candidate (John Kennedy in 1960, Ronald Reagan in 1980) or wound one, with lasting consequences (Michael Dukakis in 1988, Al Gore in 2000). Eleven campaigns have included debates in the television age, since John Kennedy shined against Richard Nixon in 1960. Being seen as the winner of the first debate hasn't guaranteed a victory in November. But in nine of the 11, it shaped the trajectory of the campaign that followed. They typically have had the most impact when an incumbent president isn't running, and when a candidate comes in with something to prove, and when the contest is close and fluid. That is, in a campaign like this one. First debates are powerful because it's a time when some voters begin to pay close attention. At an hour-and-a-half, the conversation is more extended and more grueling than any 30-second hour or 10-minute interview.
November 15, 2016	USA TODAY	Steve Balough lives 2,000 miles from Silicon Valley, but it might as well be on the other side of the world. "We don't have many jobs here," says Balough, 65, a high school teacher in West Plains, Mo., who voted for President-elect Donald Trump. "We have lumber mills, but a few shoe and clothing factories got shipped out. As far as we're concerned, the two coasts and the Midwest are two different cultures. It's like Europe is different than America." Trump's victory over Clinton -- an outcome few in the tech industry supported and many failed to believe would happen -- has engendered a mix of shock, anger, grief and denial in Silicon Valley. It's also prompted many to ask: Why and how did the companies that have become the most valuable in the U.S.  lose touch with great pools of their customers?  One thing seems certain: While many of those voters engaged with this election using the fruits of the tech industry's latest advances, sharing curated news on Facebook, settling arguments via Google and checking notifications on an Apple iPhone, few thought they were enjoying a direct economic benefit from the U.S. tech industry. In some cases, it has hurt them. Steel mills "can't keep up with cheap imports" or advances in technology, says Ray Rogg, 54, a steel worker from Erlanger, Ky. "The more automated and technical things are, and with better computers, it eliminates people," says Rogg, who has worked 26 years at the TMK Ipsco mill in Wilder, Ky. "It winds up streamlining things and taking away jobs." The tech boom may have created vast wealth and a swath of  high-paying jobs  around metro areas such as San Francisco and Seattle, but a nationwide surge in tech jobs has failed to follow. Much of the Rust Belt, South and Midwest are still reeling from the economic dislocations of globalization, the financial crisis and a technology-driven boom in productivity. "Manufacturing jobs in the current economy are going away -- we are moving to a service economy," says Steve Bennet, an adjunct professor at San Jose State University who specializes in entrepreneurship and venture capital. In interviews with Trump voters across the nation, they described themselves as working men and women who  want decent-paying jobs, with affordable health care, so they can take care of themselves and their families. Many ultimately overlooked Trump's off-putting comments because their underlying fear and anxiety about the economy runs deep. Deep red, in fact. Trump handily beat Hillary Clinton 70%-26% in counties dominated by manufacturing, according to exit polls by Edison Research. He rolled to a 60%-37% advantage in the 121 reporting counties with the highest rates of unemployment. Silicon Valley's success hasn't translated to jobs, as machines and on-demand work replace low- and middle-income work. Employment at computer and electronic companies has plummeted 45% since the 1990s, according to Labor Department statistics. They employed 1.03 million in the U.S. in August, down from 1.87 million in 2001. In the same 15-year period, total employment at semiconductor makers was halved, to 359,000. "Trump's blue-collar supporters aren't likely to be fans of the 1099 (sharing) economy," says Rakesh Agrawal, a former PayPal exec who runs freelance-marketplace Redesign Mobile. "They grew up with stable jobs with good work-life balance, cheap health care and employer-paid pensions. That is not today's economy, and that's certainly not the gig economy that Silicon Valley is creating." Hardware production has shifted overseas, as exemplified by Apple's large manufacturing facilities in China and Ireland and chip maker Micron's massive offshoring of jobs to Asia. Yet while the blue-collar voter came out for Trump, that didn't tell the full story: 48% of his voters made $100,000 a year or more and 43% held college degrees, according to exit polls. "I was intrigued by a non-establishment figure, and I agreed with his policies on immigration and health care," says Mika Pittman, 44, an IT administrator from Princeton, Minn. Automated technology and services have allowed start-ups to keep their workforces austere -- WhatsApp had 55 people when Facebook acquired it for $21.8 billion in 2014. And tech whizzes at Amazon, Tesla Motors and elsewhere have come up with high-end production lines in the U.S. that minimize people. Companies such as Amazon and Walmart are seen as marginalizing opportunities for small businesses. "Washington ignores small business," says Maxine Gutman, 56, an insurance attorney in Parkland, Fla. "I support Trump for his business background." "The economy was No. 1 for me," says Randy Herschelman, 58, a technical recruiter in Dallas. "(Trump) understands the bottom line and will delegate the right people to execute his agenda. Obamacare and taxation are killing the middle class." The future, meanwhile, is expected to bring drones, robots, driverless cars and machine learning that further reduce demand for jobs. "Digital technology is at ground zero of what's happening. It delivers enormous benefits but it also has enormous costs," says Paul Saffo, a futurist based in Silicon Valley. "The bad news is that technology accelerates the disruption in jobs. The good news is that technology gives people a place to complain about it when they don't have a job."
December 27, 2016	USA TODAY	After being ostracized by the  industry for most of the election year, there sat venture capitalist Peter Thiel, beaming, to the left of President-elect Donald Trump at the Trump Tower Tech summit in mid-December. Around him was a ring of glum-faced and pensive tech titans, including Apple's Tim Cook, Amazon's Jeff Bezos, Alphabet's Larry Page and Facebook's Sheryl Sandberg.  Silicon Valley's billionaire leaders had disavowed Trump during the campaign, throwing their weight behind  Hillary Clinton. Only Thiel stumped for Trump, and after the tech industry had turned on him for that and his role in Gawker's failure, he was luxuriating in the I-told-you-so moment. The display of power portends a roiling year or two in tech. Trump railed against Amazon and Apple in tweets about corporate taxes and cyber security; now he's likely to shape those issues as well as immigration reform, job creation, trade with China, deregulation and more as he vowed during a bruising campaign. "Tech is unusual in that the industry does not depend on government regulation or transfer payments the way that banking, pharma, defense, agriculture and energy do," says Roger McNamee, founding partner of venture-capital firm Elevation Partners. "All tech needs is policy stability and access to global markets. Trump prides himself on being unpredictable." It was a topsy-turvy year for tech, which generated $3.5 trillion in domestic economic output and accounted for more than 15 million people, or 8.4% of total U.S. employment, according to the Computer Technology Association. There were winners and losers among companies and technologies; new faces emerged while others faded; and driverless cars and drones became more visible in our streets and sky. Whether computer breaches that compromised the personal information of millions of consumers to a targeted hack by Russian operatives that conceivably tilted the U.S. presidential election, the very nature of conflict transformed this year, McNamee says. And with the advent of the Internet of Things, the battlefield could extend to our homes, security experts warn. Samsung's stumble with the self-igniting Galaxy Note 7 was an epic meltdown of quality control, distribution and marketing. Though it didn't dislodge the South Korean electronics giant as the pre-eminent smartphone seller globally, it undercut  trust. Yahoo disclosed it had been the victim of two megahacks that compromised more than 1.5 billion accounts and jeopardized its $4.8 billion deal with Verizon. Artificial intelligence is officially a craze -- Facebook, Apple, Google and Microsoft are among those with aggressive plans. Virtual reality became more of a reality. Drones are popping up in all shapes and sizes. Self-driving cars took to the streets in Michigan, Pennsylvania, Arizona and California. Fully autonomous cars won't be available for a few years, but a Morgan Stanley study estimates they will lead to productivity gains of $507 billion annually as consumers spend less time commuting and more time in meetings, writing reports and other business tasks. There was nothing fake, however, over fears on what AI and increased automation will do to the workforce. This is sure to draw the attention of Trump, who lambasted Apple for exporting jobs overseas and discussed jobs creation at the  tech summit. His focus on immigration reform will undoubtedly pinch H-1B visas and heighten the urgency for increased STEM education. What is unclear is how it might play into tech's stuttering attempts to become less homogenous by hiring more of the women and minorities who buy its products but have little role in their design. There are 500,000 computing jobs open in the U.S., with an expected 20% growth rate over the next decade -- yet only 55,000 bachelor degrees in computer science were doled out in 2014, according to Code.org and the Bureau of Labor Statistics. "It's more important than ever," says Dennis Yang, CEO of Udemy, an online learning marketplace with more than 14 million students in 190 countries. Tech's impasse with the Trump administration over job creation seems inevitable, but there may be hope. In his meeting with the reluctant CEOs, Trump vowed to keep the channels of communication open and meet quarterly. 
January 4, 2017	USA TODAY	The auto industry's showdown with Donald Trump over made-in-Mexico, sold-in-the-U.S. vehicles revved up Tuesday as  General Motors and Ford  moved to fend off attacks on their commitment to American manufacturing. Ford announced it would cancel a planned  $1.6 billion Mexico plant and expand a Michigan factory, creating 700 jobs, after withering criticism from Trump.  Earlier, General Motors was forced to defend its Chevrolet Cruze production in Mexico after Trump tweeted: "Make in U.S.A. or pay big border tax!" The developments illustrate the new era of give-and-take for Detroit's Big 3 automakers, whose relationship with the president-elect figures to be complex. On one hand, there's a gaping divide between U.S. automakers and Trump on trade. Trump wants to renegotiate or trash the industry's treasured North American Free Trade Agreement, which he blames for weakening American manufacturing. He also has threatened  a 35% tariff on American companies' products made overseas and sold in the U.S. In other ways, however, the auto industry is welcoming change, even after eight years of a White House that rescued GM and Chrysler from liquidation. "Automakers are facing a situation where they have to consider the political consequences" of their decisions, AutoTrader.com analyst Michelle Krebs says. A: Yes. Labor costs for automotive assembly are 80% lower in Mexico than in the U.S., according to a report in August 2016 by the Center for Automotive Research. Although security and transportation costs are higher in Mexico, the country still offers considerably lower cost of production, particularly on small, fuel-efficient cars with thin profit margins.  So shifting production back to the U.S. likely would hurt the bottom line for automakers and suppliers. "That could have a pretty substantial impact on profitability," LMC Automotive analyst Jeff Schuster says. A: Hard to say, since details are lacking. But few in the industry believe the threatened 35% tariff is actually feasible. "I believe 35% is almost inflammatory," says Michael Harley, senior analyst at Kelley Blue Book, noting Ford's 2016 profitability could have been wiped out if it had to pay the tariff. "It gets everyone's attention, but it's nearly impossible." Still, the pressure on the auto industry  could be persistent. That could have major ramifications on future decisions on automakers' global operations. "We're going to see pressure from Trump and his tweets, and you are going to see public scrutiny," he says. A: Possibly, especially if  automakers can pull off announcements that generate  headlines for Trump to trumpet while making few substantive changes to their actual policies. Optics may matter more than substance. But don't expect a significant shift in manufacturing from Mexico to the U.S. The Center for Automotive Research projected that the U.S. share of North American automotive production would fall from an all-time low of 63% in 2016 to 58% in 2020. A: Not for now. If Trump follows through on the threat of a 35% tariff, Mexican-made cars will likely become more expensive for American consumers. Theoretically, though, "it might end up with more jobs here," Center for Automotive Research analyst Kristin Dziczek says. "If we have more jobs, more employment and wages go up, and prices go up too, that's OK. If wages don't go up and prices go up, that's a problem." A: Ulterior motives. Although expanding in Mexico makes financial sense, automakers may be willing to relinquish some Mexico production plans in exchange for  concessions in other areas. Currying favor with the Trump administration is  important to the auto industry, which wants Washington to loosen fuel-economy regulations and avoid a potentially devastating trade war with China. Ford's move reflects that strategy, Schuster says. "There's clearly a lot going on that's below the surface of this," Schuster says. "It's likely to gain some influence on other activities that's coming down the road." 
December 7, 2016	USA TODAY	Telecommunication giant SoftBank Group plans to invest $50 billion into the U.S. economy, and add 50,000 jobs, President-elect Donald Trump announced  Tuesday. He made the announcement over Twitter after meeting with SoftBank CEO Masayoshi Son for 45 minutes at Trump Tower. The Japanese company has a majority stake in Sprint, whose plans to merge with rival T-Mobile were thwarted by the Obama administration.  Son's summit with Trump is very likely to rekindle the possibility of a merger between Sprint and T-Mobile, wireless analyst Chetan Sharma says. "Today's visit is just groundwork for an inevitable deal," Sharma says. "Son has a strong interest in pursuing the merger." Son did not say what specific investments SoftBank would make, though he told The Wall Street Journal they would be part of a previously announced $100billion tech investment fund. "We were talking about it, and then I said I'd like to celebrate his presidential job," Son said at an impromptu news conference in the Trump Tower's lobby. Sprint  shares rallied as much as 7%, to $8.61, hitting a  52-week high, before ending 1.5% higher. T-Mobile shares rose 1.8%. In his unlikely march to the White House, Trump campaigned on bringing more jobs to America, particularly in  regions hit hard by the recession and globalization. He took swings at companies such as  Apple for making most of their products outside the USA. SoftBank is the second high-profile accord he's landed to underscore his message to voters. Last week, Trump announced a controversial deal to keep furnace manufacturer Carrier from outsourcing about 1,100 jobs to Mexico. Carrier will get $7 million in state tax incentives to keep the jobs in Indiana. Son, who became a billionaire through investments in Japan and China, is in the midst of raising a $100 billion fund with Saudi Arabia and others. He's had mixed results in the USA since SoftBank bought what is now an 80% stake in Sprint for $21.6 billion and lost ground to telecom rivals such as T-Mobile. SoftBank plunked down $32 billion this year to acquire ARM Holdings, a U.K.-based chip designer that makes parts for Apple's iPhone and other products.
March 15, 2016	USA TODAY	The American worker is being crushed. Workplace participation for women has declined by more than 3 percentage points since 2000. The percentage of men in their prime working years without a job has nearly tripled since the late 1960s. Median annual household incomes are down more than $4,000 from the beginning of the century.  One of the factors driving this economic devastation is America's disastrous trade policies.  Under decades of failed leadership, the U.S. has gone from being the globe's manufacturing powerhouse to a rapid deindustrialization that has evaporated entire communities. The situation is about to get  worse if the Trans-Pacific Partnership is not stopped. One of the first casualties  will be America's auto industry, and among the worst victims of this pact will be the people of Ohio. The TPP will send America's remaining auto jobs to Japan. Yet, Gov. John Kasich, Sen. Ted Cruz and Sen. Marco Rubio have all promoted the Trans-Pacific Partnership. The TPP -- a 12-nation pact -- includes Vietnam, which has vastly lower wages than America. Since there is a small market for U.S. goods in Vietnam, this will be an almost entirely one-sided arrangement as thousands of U.S. workers are laid off and production shipped to Vietnam instead. An Economic Policy Institute (EPI) analysis found that Ohio has  lost more than 100,000 jobs to TPP countries. If the deal is enacted as Kasich has urged, those numbers will skyrocket. TPP is the biggest betrayal in a long line of betrayals where politicians have sold out U.S. workers. Since the North American Free Trade Agreement was signed in 1993, we've lost approximately 900,000 jobs to Mexico alone, pro-labor EPI found. Yet Gov. Kasich voted for NAFTA, just like he now supports TPP. China has been one of the worst offenders. While promoting China's addition to the World Trade Organization in 2001, the U.S. agreed to permanently confer on China  "most favored nation" trading status. EPI estimates that the United States has lost 3 million jobs to China since that decision was made. Overall, since 1997 -- driven by NAFTA and China -- the U.S. has lost nearly one-third of its manufacturing jobs, EPI analysis shows. We've lost over 80,000 factories during that time. I am the only candidate who will bring our manufacturing jobs back. I have been warning for decades what would happen if we didn't confront foreign trade cheating, and sadly, my fears have come to pass as the United States has seen its trade deficit in goods soar to $759.3 billion last year. If we bring back these jobs, and close this trade deficit, we will create millions of jobs, boost government revenue, shrink our deficit, rebuild our infrastructure and communities, and send wages soaring upwards. Under a Trump administration, we will finally stand up for American workers and make America great again.
