November 17, 2016	USA TODAY	When Japanese Prime Minister Shinzo Abe meets with President-elect Donald Trump in New York on Thursday, much will be at stake -- for both sides. Abe is likely to try to salvage at least part of a major trade deal, secure a commitment to Japan's continued defense and establish a working relationship with the next U.S. leader who has a history of bashing Japan and campaigned on a platform of "America First."  The meeting will be Trump's first with a foreign leader since his election victory last week. He has yet to announce his foreign policy team, and people overseas -- particularly in Asia, where China has mounted a challenge to U.S. power and influence -- will look for assurances that the United States will remain engaged. "It's still too soon to know what effect Trump will have on East Asia, or Japan in particular, until we know more about his specific policies and appointments," said Sean King, an East Asia specialist with the Park Securities consulting firm. "Abe can underscore our two countries' shared values and stress how the U.S.-Japan alliance helps keep open markets, energy routes and world shipping lanes ... and convey to the president-elect how much we could both lose if things ever went awry," he said. Few countries were as shocked by Trump's election as Japan, a longtime U.S. treaty ally and major trading partner. Abe dispatched a senior adviser to meet with Trump representatives Monday and reworked travel plans to meet with Trump this week on his way to an economic conference in Peru. During the fractious campaign, Trump promised to kill the Trans-Pacific Partnership, a 12-nation trade deal that is key to Abe's economic plans. The pact, known as TPP, excludes China. Although TPP cannot go into effect without U.S. support, Abe has continued to push for ratification in Japan's parliament, the Diet, and is likely to warn Trump that rejecting the trade deal could push U.S. partners in Asia toward a separate trade deal, known as the Regional Comprehensive Economic Partnership, that includes China. "There's no doubt that there would be a pivot to the Regional Comprehensive Economic Partnership if the TPP doesn't go forward," Abe told Diet members last week. Trump questioned whether Tokyo pays enough support for the 50,000 U.S. troops based in Japan. The Defense Department has sent additional troops and its newest and most advanced aircraft, warships and weaponry to the Asia-Pacific in recent years as part of the Obama administration's "re-balance" to the region. Tokyo spends about $1.8 billion a year to  defray the costs of U.S. troops based in Japan. Trump said during the campaign that's not enough and suggested he might draw down U.S. forces if Japan doesn't spend more. The Asia Foundation, based in Washington, warned in a report this week that drawing down U.S. forces could trigger an arms race in the region and might  prompt Japan and South Korea to build their own nuclear weapons. 
October 17, 2016	USA TODAY	"I'll be honest with you. When it comes time, I probably won't know until the end," said the 63-year-old owner of a title company in this small Rust Belt city. This is what passes for certainty in Clark County, where Springfield is the county seat and largest town. It's a swing county in the quintessential swing state. In 2012, Clark County supported GOP candidate Mitt Romney, but by only 523 votes out of 64,301 cast for president. Its purple-county status isn't the only reason Clark County matters this year, either. For Trump to win the election, he must steal away blue-collar Democrats from Hillary Clinton -- people who, like Clark County's residents, generally are whiter, poorer and less educated than Ohio as a whole. Ohio has a larger share of white residents without college degrees than nearly any other swing state. That's why it has remained close or leaned a few points toward Trump while Clinton pulls ahead in other states. In Clark County, it's clear not all of these blue-collar voters are sold on Trump. His protectionist promises and rhetoric about job-stealing immigrants resonate with some of the county's fence-sitters. But many others are turned off by his inability to campaign with discipline and stay on point on the topics they care about. And despite what the stats -- and Trump -- may say, others just don't feel the desperation he describes. Even five years ago, beleaguered Clark County might have been more interested in Trump's message, said Michael McDorman, president of the Greater Springfield Chamber of Commerce and a Springfield native with deep family ties to the manufacturing industry. But now, the county is clawing its way out of its economic hole, diversifying with new service-sector jobs and rejuvenating its downtown. Even manufacturing is hiring again, bringing back blue-collar jobs. "We're starting to see a change in Springfield. We're starting to see people believe in themselves again," he said. "We're starting to see us move forward and take some risk in order to move forward." Seven years ago, Cheri Crothers returned with her husband to Springfield, her childhood home. She found a city transformed, but not for the better. She reels off a list of manufacturers that disappeared. "We were driving through Springfield, and there was closed-up Robbins & Myers; William Bailey's gone, SPECO's gone," said Crothers, a Democrat. "A lot of these manufacturers that I remember as a child growing up here, that were so active, were not here anymore." Kyle Koehler owns the tool and die company K.K. Tool Co. in Springfield and represents Clark County as a Republican in the Ohio House. The North American Free Trade Agreement, or NAFTA, became law in 1994 and was hailed by both Republicans and Democrats as a tool to eliminate barriers to trade and investment between the U.S., Canada and Mexico. In Springfield, NAFTA is still a dirty word. While other factors lured away jobs and sometimes shut down entire factories, NAFTA bears some of the blame -- and gets plenty of it. Before NAFTA, Koehler recalled, you could walk into a home improvement store and pick up steel wool made by International Steel Wool and see "Springfield, Ohio" on the back. "Because of NAFTA, that company packed up, went to Mexico and in a year folded and was gone," he said. "It was a good, vital company that was in Springfield that provided jobs, and not only was it no longer in Springfield, it no longer existed." The post-NAFTA job losses felt fatal to an economy centered on manufacturing. In 2000, 30% of the county's gross domestic product, or GDP, came from manufacturing. In 2014, only 17% did. Now, only two manufacturers -- Navistar and Honda -- break the top 10 private employers in Clark County, a list historically dominated by manufacturing. The county's top private employers are now the local health care system, Community Mercy Health Partners, and a call center for insurance company Assurant Specialty Property, according to the chamber of commerce. For McDorman, the chamber president, the past 15 years have been the aftermath of job losses that peaked at the turn of the century. The loss of good-paying manufacturing jobs gut-punched the area's middle class. In 2001, only one in five of the county's population earned lower-tier incomes. By 2014, a third of the population did, according to a Pew report this year. Median household income fell more than a quarter in 15 years, to $53,957 in 2014, according to a Pew analysis of U.S. Census data. Doane, the title company owner, said he can't bring himself to vote for Trump but understands why the candidate's message might resonate with some voters. "There's a lot of unhappy people, and they're just really unhappy with the system. And I think they think Trump is an answer," he said. Springfield's economy is changing, and its emerging future bears little resemblance to Trump's statements about a revival of manufacturing. Speedway, the convenience store chain, is expanding its headquarters in Clark County, adding 450 jobs. EF Hutton, a financial services provider, opened its doors in late September and plans to hire more than 400. McDorman said a medical supply company is planning to relocate to downtown Springfield with 300-plus jobs. Even manufacturing isn't disappearing entirely. Koehler said his business is expanding and taking back work from China. "Our heart and blood is manufacturing, but with people like EF Hutton coming to town, bringing white collar jobs, professional jobs, that's important," said Koehler, the state representative. "We've sort of diversified over the years." Lynda Smith, the Republican Party chairwoman for Clark County, says "a lot" of Democrats are asking about switching to Trump. She doesn't ask questions. Union workers, who generally vote overwhelmingly Democrat, remain a political force in Clark County. Jason Barlow, president of the United Auto Workers Local 402, which represents local workers at Navistar, said internal polling has shown some GOP union members are considering Clinton, while some Democratic members are considering Trump. On the whole, he said, the 1,200-member union is likely to break down along party lines as it has in the past. And the 4,300 union retirees might lean more toward Trump. "This election here, it's been an anomaly," he said. "Our membership has had ... interesting debates, let's just say that." The shift in Clark County's economy means the blue-collar union bloc may not matter as much as it once did. The largest voting bloc in the county, according to GOP chairwoman Smith, is undecided. "Hillary has too much baggage following her, and Donald Trump is too much of a reality TV show," said Robinette, a collections manager. ." The brothers look like Trump supporters. But looks can be deceiving. Neither plans to vote for Trump.
December 9, 2016	USA TODAY	The pro-U.S. foreign policy of South Korean President Park Geun Hye is at risk now that she appears to be on her way out over a growing corruption scandal. Park, whose approval ratings are an abysmal 4%, faces possible impeachment by South Korea's legislature  -- if she doesn't resign first -- and massive street protests over the power she is accused of granting to a controversial personal friend, Choi Soon Sil. Prosecutors allege that Choi, the daughter of a deceased cult leader who mentored Park, used her relationship with the president to extort $68 million in corporate donations to foundations Choi controlled and invested the money. Park's initial policy toward North Korea was to engage through trust-building measures, but her approach made an abrupt turnaround after the North's nuclear test in January. "It affected everything with North Korea, China and Japan," said John Delury, who teaches international studies at Yonsei University in Seoul. "Now, with the equally sudden demise of the president, it puts into question the new hard-line policy." In February, Park ordered South Korean companies to pull out of the Kaesong Industrial Complex to protest a North Korean missile launch. The plant, which uses North Korean labor and South Korean management and expertise, was a major source of funds for the North and one of the few remaining avenues for cultural exchange between the two countries. Park's new approach was in line with U.S. efforts to isolate North Korea and deprive it of foreign sources of income. President Obama said in September that new and existing sanctions show North Korea there are "consequences to its unlawful and dangerous actions." Kathleen Stephens, who served as U.S. ambassador to South Korea from 2008 to 2011, said opposition parties are likely to call for more active efforts to re-engage with Pyongyang on a raft of issues and to argue that Park's hard-line policy has not worked. It would be "a major project" to reopen relations with the North, but options would include a resumption of food and humanitarian aid, plus family reunions that took place in past years. Chung In Moon, a foreign affairs adviser to South Korea's opposition, called in September  for suspending joint military exercises with the United States and for encouraging dialogue with the North. Such a move by South Korea would be seen as a step toward rejecting the U.S. security umbrella in the region that has existed since the 1950s, said Yun Sun, an analyst at the Stimson Center, a Washington think-tank. After North Korea conducted its fifth nuclear test, in September, Park approved the deployment of a U.S. missile-defense system called the Terminal High Altitude Area Defense (THAAD) to protect South Korean cities and 28,500 U.S. troops stationed in her country. The proposed deployment angered China -- South Korea's most important trading partner -- which sees the system as a threat to its aircraft and missile capabilities. The deployment is controversial among South Koreans who question the system's effectiveness, Delury said. "There is evidence already that North Koreans are figuring out a way around it," he said. South Korea's liberal opposition party, which seeks better relations with China in hopes it could temper North Korea, is among the fiercest critics of THAAD. Though the liberals may not cancel the $850 million system financed by the United States, they could probably block its expansion. If President-elect Donald Trump follows through on his campaign promise to make U.S. allies pay more for their defense, the THAAD deployment could be scrapped. Park's government ordered South Korea's military this year to exchange security information for the first time with Japan, a bitter enemy in past decades. The arrangement was encouraged by Obama and his predecessors who've long sought to reconcile the U.S. allies, so they could cooperate on security and form a unified front against North Korea and China. Many South Koreans continue to distrust Japan because of its occupation of Korea during the first half of the 20th century, said Jenny Town, assistant director of the U.S.-Korea Institute at the Johns Hopkins School of Advanced International Studies in Washington. "South Koreans are always very skeptical of too much military cooperation between South Korea and Japan because of the history between the two countries," she said. North Korea and China see the arrangement as "the U.S. trying to create collective security," Town said. How a post-Park South Korea balances policy toward the United States and China is hard to predict, in part because the United States is going through its own transition, Stephens said. South Korea's trade with China has gotten so big that South Koreans worry about over-dependence. "That's why the U.S. alliance has come to be more valued," Stephens said, but Korea has "a huge relationship with Beijing." As a candidate, Trump called the U.S.-Korean Free-Trade Agreement reached in 2012 a "job-killing trade deal." He threatened to impose tariffs on Chinese imports, which would hurt the economies of all the countries in the region. To save the free-trade agreement, South Koreans would "point out increased trade and services that benefit the U.S.," Stephens said. "They're watching very closely, wondering what the new Trump administration will do." South Korea is also developing an alternative, since it shares a long history with China, and trade between the two outweighs trade with the United States and Japan combined. Many among South Korea's opposition hope to develop a more conciliatory atmosphere toward China, Sun said. The "Chinese feel confident they have a piece of critical leverage over South Korean politicians," Sun said. 
December 5, 2016	USA TODAY	America's new secretary of Defense nominee has an apparently quite divergent -- and more realistic -- sense of the world than either President-elect Donald Trump or even, in some respects, the new nominee for national security adviser, retired Army lieutenant general Michael Flynn. Trump must bring himself to tap these resources before impulse and emotions send the nation off the rails, perhaps irrevocably.  Retired Marine general James Mattis sees Russian President Vladimir Putin not through rose-colored glasses but as the autocrat that he is. Mattis recognizes the value of our Iran nuclear treaty and rather than ripping it up, he'd prefer to make sure it's enforced to the hilt. Mattis also apparently already talked Trump down off the  ledge of waterboarding as an interrogation technique, believing instead in the value of a "pack of cigarettes and a couple of beers." Even so, there's still so much  unknown about either of the two retired generals  and how they may be used in crises, or in just day-to-day phone calls or tweets. Let's hope Trump never consulted Flynn or Mattis before taking that perhaps fateful call from Taiwan's president that could push America and Asia further down a path toward conflict that Mattis could be left in the end to sort out. China's brilliant foreign minister, Wang Yi,  cut Trump some slack -- this one time -- laying the blame for the first direct conversation between a U.S. and Taiwanese president or president-elect in 37 years squarely on Taiwan's new leader, Tsai Ing-Wen. But the learning curve is pretty short and steep. Trump must learn to consult with someone wiser than he is in the world of war and diplomacy. The stakes are enormous. In Mattis, there's an individual who is deeply experienced and eminently schooled. Unlike Trump, who is not known to have read any book recently, even one with his name on the cover, Mattis has accumulated a library of more than 7,000 titles. He has even helped write The U.S. Army/Marine Corps Counterinsurgency Field Manual with then-Gen. David Petraeus, considered a potential finalist with Mitt Romney for secretary of State. The question is how broadly real wisdom might exist in the Trump administration. If Trump had indeed planned to send a message of a deliberate and strategic pivot to India by taking a call with the prime minister of its neighbor and arch foe Pakistan, or to Beijing in Friday's call with Taiwan, then each should have been preceded by other moves to lay the groundwork so his calls won't be misinterpreted. Presidential transitions have often been used to test us by friends and foes alike. Trump would be wise not to make more foreign moves without consulting experienced hands like Mattis, or his eventual secretary of State. David A. Andelman, a member of the USA TODAY Board of Contributors, is editor-emeritus of World Policy Journal. 
July 28, 2016	USA TODAY	Angst over trade is rusting the lock Democrats have enjoyed on the industrial Midwest in recent presidential elections, turning the region into perhaps the central battleground in the contest between Democrat Hillary Clinton and Republican Donald Trump. From eastern Iowa to western Pennsylvania, the Rust Belt  has proven widely and unexpectedly receptive to Trump's candidacy and may represent his only viable pathway to victory, party leaders, operatives and observers said in interviews at both party conventions over the past week. Recognizing this, both campaigns are building infrastructure in the states and formulating key decisions based on how they'll play with Midwestern voters.  "If we don't have a change of the map from Pennsylvania through Iowa, then we're not going to win this election," two-time Republican presidential candidate Rick Santorum told Iowa's convention delegation in Cleveland last week. President  Obama carried Iowa, Wisconsin, Michigan, Ohio, Pennsylvania and their collective 70 electoral votes in 2012. Should that Democratic firewall erode and some or all of those states flip to Trump, it could represent the most significant electoral swing of any region in the country: If all five went for Trump while the rest of the electoral map remained unchanged from 2012, he would win. And polling from across the region suggests Trump is competitive. Clinton holds leads in all five of those states, according to polling averages compiled by Real Clear Politics, but with margins of less than 6 percentage points. "You go right across -- Pennsylvania, Ohio, Iowa are all places where Trump is at or ahead of Romney's numbers," political statistician Nate Silver  told The Des Moines Register in Cleveland. Iowa, a perennial presidential swing state, sits on the far western border of the industrial crescent surrounding the Great Lakes, but appears to be among the most competitive and will be a frequent stop for both candidates in the weeks to come -- including on Thursday, when Trump makes his first visit to the state since the Feb. 1 caucuses. Consider the views of Jesse Gonzales. The 26-year-old from Lakewood, Ohio, was a magnet for  reporters on the first day of the Republican National Convention last week when he went strolling through a downtown Cleveland plaza wearing a Trump campaign hat and an AK-47 rifle strapped to his back. But the most critical political issue he saw -- besides maintaining rights of gun owners -- was a lack of economic opportunity. And he blamed trade policy for it. "The government is not being protectionist enough," Gonzales said. "It's the government's job to ensure that our economy is functional and they failed to do so. They've made sure that other country's economies flourish." Indeed, Dennis Kucinich, a former congressman from Cleveland and Democratic candidate for president, pointed to global trade and free-trade agreements as the primary factor putting the Rust Belt in play this year. "Trade has stripped this area not just of the financial power of major industries but also thousands of small manufacturing and companies" he said. "NAFTA, the General Agreement on Tariff and Trade, China trade and now the Trans-Pacific Partnership all are part of a disaffection that working people have with both political parties." Kucinich, known as a liberal during his time in office, said he was not comfortable with Trump's political style but credited him with recognizing the political potency of trade and addressing the issue more clearly than any  candidate in the race. Hillary Clinton has taken a more nuanced approach on the trade issue. As first lady, a U.S. senator and secretary of State, she took a range of positions on various trade deals, and since becoming a presidential candidate she has suggested changes are necessary to the pending Trans-Pacific Partnership. Her chief Democratic rival, Bernie Sanders, ran heavily on opposition to free trade during his challenge to Clinton -- leading Trump to explicitly court Sanders voters in recent weeks. "To all the Bernie voters who want to stop bad trade deals & global special interests, we welcome you with open arms. People first," Trump tweeted on July 12. Santorum, who represented western Pennsylvania in Congress before going to the Senate, recalled attending a Trump event in the traditionally Democratic town of Monessen, Pa., last month and encountering several onetime Democrats now supporting the GOP nominee. "Trump is able to get voters who feel disenchanted from Democrats because Hillary Clinton is a Wall Street globalist," Santorum said. "She is a not a blue-collar, working person's candidate, and Trump is." Republicans in Cleveland contended that vice presidential nominee Mike Pence's addition to the ticket would further boost Trump's chances in the region, as the Indiana governor reflects Midwestern values and quells doubts about the nominee's inconsistent record and bombastic rhetoric. "He's a conservative, Midwestern governor who's had a good track record of bringing jobs to Indiana," Iowa Gov. Terry Branstad said. "He's stable, reliable and he's both a social and economic conservative. I think he reassures people who may have had some misgivings." Clinton, in turn, is taking no chances in Iowa and across the region. After the convention, she'll travel across Pennsylvania and into Ohio for her first campaign swing as the party nominee.
