November 10, 2016	USA TODAY	Donald Trump's win was largely expected to lead the Federal Reserve to rethink lifting interest rates next month. In the aftermath of Trump's victory to become the 45th president of the United States, both of those theories are in question. Some economists and futures markets still expect the Fed to act after stocks rebounded from a stomach-churning overnight sell-off. Paul Ashworth of Capital Economics told investors immediately after Trump won, while global markets and U.S. stock futures were in disarray, that he expected the Fed to hold off. But after markets rallied Wednesday following Trump's conciliatory victory speech, "you could see the Fed following through," he told investors in a conference call. He noted economic growth and inflation are likely to pick up in coming months. The Fed lifted its benchmark rate in December for the first time in nine years but has held it steady since amid market volatility, the United Kingdom's Brexit vote, China's economic slowdown and meager U.S. inflation. The Fed signaled in its post-meeting statement last week it's poised to raise its federal funds rate from a historically low 0.4% in December, barring adverse shocks to the economy. Economic growth accelerated in the third quarter after a sluggish nine months, job growth has been steady and wage gains picked up in October, auguring more rapid inflation. Bernard Baumohl, chief global economist of the Economic Outlook Group, said the Fed will move next month in part to provide space to lower rates again next year. Wednesday, Fed fund futures gave about 76% odds of a rate increase in December, unchanged from the previous day. "There's just too much uncertainty out there now," said economist Gus Faucher of PNC Financial Services Group. 
December 22, 2016	USA TODAY	The Air Force's top officer said the service is critically short of personnel and needs to expand by more than 30,000 active-duty service members to meet its security obligations, including an air war against Islamic State militants. "We just got too small too fast, and we've got to grow," Gen. David Goldfein, the Air Force chief of staff, told USA TODAY in an interview Wednesday. "We're at a risk level I'm not comfortable with."  Goldfein, who was completing a five-day tour of air bases around the country,  said the trip reinforced his concerns that the service is stretched thin. "The shortage of people has fundamentally changed the way we do business," he said. "To most of the American people, they still think they have the Air Force of Desert Storm (the Persian Gulf War of 1990-91), and we're not even close." President-elect Donald Trump, who promised to rebuild the military, will probably face an array of requests from the services, which have lobbied for more troops and weapons in years past but have had to preside over smaller forces recently because of budget pressures despite a resurgence of threats, particularly in the Middle East. Goldfein said he will recommend expanding the size of the active-duty Air Force from about 317,000 to 350,000. It would probably take five or six years to reach the higher level. Under current plans, the Air Force planned to grow to 321,000. The increase in personnel size would cost about an additional $3billion a year on top of the Air Force's $151 billion budget. The U.S. military withdrew from Iraq in 2011 and has reduced the size of its force in Afghanistan to less than 10,000. In 2014, the Islamic State swept into Iraq and other parts of the Middle East, prompting the Obama administration to deploy roughly 5,000 troops in Iraq and begin a bombing campaign over Iraq and Syria. U.S. aircraft have dropped thousands of munitions targeting the Islamic State in both countries. The Air Force ferries tons of weapons and ammunition to Iraqi forces battling the Islamic State and has air-dropped supplies to a rebel force marching on Raqqa, the Islamic State's de facto capital in Syria. It is also responding to other global crises. "It seems like every two weeks, we're responding to a crisis or event around the globe," said Gen. Carlton Everhart, commander of the Air Mobility Command at Scott Air Force Base in Illinois. Russia and China are emerging as potential threats that could challenge the  military in ways the Islamic State has not. China is expanding its presence in the South China Sea, and Russia has become a major player in Syria's civil war, siding with the regime of President Bashar Assad. The  Air Force has rarely been challenged in the skies during its campaign against the Islamic State. That could change if the United States were to face another nation's military capable of rivaling  U.S.  technological advantages. This week, Goldfein spent a night with a crew in an underground nuclear control facility in a remote windswept corner of Nebraska. Airmen guard the facility round the clock, and a pair of young officers sit at the controls that would launch nuclear-tipped Minuteman III missiles from nearby silos if the president ordered strikes. 
January 13, 2017	USA TODAY	James Mattis, Donald Trump's nominee to head the Pentagon, testified Thursday that he supports efforts to engage with Russia but doubted the two countries would find ways to cooperate. Trump has spoken somewhat admiringly of the Russian leader and suggested the two countries could cooperate in fighting the Islamic State.  Mattis faced mostly polite questioning during a confirmation hearing before the Senate Armed Services Committee, suggesting his nomination will not face serious opposition in the Senate. Democratic leaders expressed hope that Mattis, a blunt-talking retired Marine four-star general, would be a moderating influence on Trump, whose controversial statements and tweets have fueled concerns about his character. "You will help oversee national security policy for a president who lacks foreign policy and defense experience and whose temperament is far different from prior presidents," Sen. Jack Reed, D-R.I., told Mattis. "Many Americans, and many in this body on both sides of the aisle, are rightly concerned about how he may respond when he is tested by Russia, Iran, North Korea and other transnational threats such as cyber." Mattis, a combat leader with more than four decades of uniformed service, is a departure from most recent Defense secretaries, who came from the ranks of civilian government service or politics. The Republican-led Senate passed a waiver 81-17 Thursday to allow Mattis to run the Pentagon, since federal law requires a seven-year gap between retirement from the military and assuming the Cabinet post. The statute was designed to safeguard the principle of civilian control over the military. The last retired general to head the Defense Department was George Marshall in 1950. The House Armed Services Committee also backed the waiver in a 34-28 vote. The full House is to vote Friday. Mattis described growing global threats and said the U.S. armed forces must remain the best led and "most lethal" in the world, admitting the nation has "shrunk our military capability." Mattis said there are "an increasing number of areas where we will have to confront Russia," adding that Putin is "trying to break" NATO. Mattis said if he is confirmed he would meet with the Trump administration's new security team to craft a strategy to confront Russia. More broadly, threats from Russia, China and global terrorism represent the biggest threat to world order since World War II, he said. Mattis faced questions from lawmakers about the integration of women into the infantry and other "combat arms" jobs. Women have served extensively in combat in Iraq and Afghanistan, but until recently, they have been barred from some "combat arms" jobs, such as the infantry. Under the Obama administration, Defense Secretary Ash Carter ordered that all jobs, including the infantry, be open to women. Sen. Kirsten Gillibrand, D-N.Y., cited speeches Mattis made expressing concerns about allowing women into the infantry, a physically demanding job that requires living for long periods of time under primitive conditions. Mattis said he was coming into the job without preconceived ideas. "I have no plan to oppose women in any aspect of our military," Mattis said. He said his chief concern was military readiness and the "lethality" of the force, which could suggest he might review some aspects of the policy if it could be shown that it hurt capabilities. The Marine Corps asked in 2015 for an exemption for its infantry units after a study that showed mixed-gender infantry squads were not as combat-effective as all-male units. Carter denied the exemption request, and the Marine Corps is taking steps to open the infantry to women. Mattis is revered inside the Marine Corps, where his aggressive style and frank conversation  were prized by young Marines. He commanded troops in Afghanistan in 2001 and  Iraq in 2003 and 2004. He served as an infantry battalion commander during the  Gulf War in 1990-91. He headed U.S. Central Command, which oversees operations in the Middle East, and  met frequently with leaders throughout the region.
December 12, 2016	USA TODAY	The Federal Reserve is virtually certain to raise interest rates this week for the first time this year, but the course of future hikes has suddenly become cloudier. The Fed has signaled for many weeks that it plans to hoist its key rate by a quarter percentage point at a two-day meeting that begins Tuesday, and futures markets say there's a 93% chance it will follow through. Meanwhile, President-elect Donald Trump's fiscal stimulus proposals may ultimately require faster rate increases to head off inflation, while other byproducts of his plan could slow the economy and prompt the Fed to act more cautiously.  For now, economists don't expect Fed policymakers to weigh such hypotheticals as they draft  quarterly projections for rate increases over the next few years. Even so, with unemployment falling rapidly and inflation finally picking up, Fed officials likely are no longer inclined to call for slower rate hikes over the long-term, as they have in each of their previous forecasts this year amid headwinds such as weak productivity growth, economists say. "Unemployment is falling toward levels that are arguably below stable inflation," says Tim Duy, a University of Oregon  professor and author of the Fedwatch blog.  He says the Fed will almost certainly reiterate that rate increases will be gradual. In November, the jobless rate dropped to 4.6% from 4.9% the previous month. That's already below the 4.8% that the Fed has deemed the lowest average rate sustainable without generating excessive inflation, or rapid price increases that decrease consumers' purchasing power and especially hurt savers and those on fixed incomes. Low unemployment typically pushes up wages as employers compete for fewer  workers, and price increases typically follow as the firms scramble to maintain profit margins. That doesn't mean persistently low inflation is poised to suddenly spike. While an inflation measure closely monitored by the Fed rose from 1.2% to 1.4% annually in October as the effects of low gasoline prices faded, that's well below the Fed's 2% target. Still, it was the fastest pace in two years. And annual wage growth hit a seven-year high in October and has climbed steadily since early 2015 in "a further signal that inflation is firming," Barclays economist Michael Gapen wrote in a note to clients. In September, Fed Chair Janet Yellen noted that discouraged workers on the sidelines were streaming back into the labor force, keeping the unemployment rate elevated and providing the economy "more room to run" without stoking inflation. But the labor force shrank in both October and November, giving the Fed another reason to make a move this week and stick with its previous forecast of two rate hikes next year and three in 2018. "If you were to wait any longer, you would risk getting behind the curve," says JPMorgan Chase economist Michael Feroli. The Fed held off on rate increases earlier this year in response to China's slowdown and a sluggish U.S. economy, among other factors. The future roadmap is fuzzier. Trump has proposed a $1 trillion plan to upgrade the nation's infrastructure and sharp tax cuts, a stimulus package that, if passed by Congress, could fuel inflation and force the Fed to lift rates more rapidly. But, "it's probably too early for the Fed to incorporate any fiscal policy issues into their forecast," Duy says. It's similarly too soon, he says, to anticipate negative economic fallout from Trump's restrictive trade proposals. On the other hand, the prospect of more federal spending and faster economic growth and inflation under Trump already has strengthened the dollar and pushed up long-term interest rates. Those developments  could crimp the economy by hurting  exports and discouraging consumer and business borrowing. 
November 1, 2016	USA TODAY	Republican presidential nominee Donald Trump has made bashing China and Mexico a staple of his campaign. Both he and Democratic nominee Hillary Clinton have turned sour on the Trans-Pacific Partnership (TPP), the proposed pact linking 12 nations in Asia (excluding China) and the Americas. And recent numbers show that trade volume has flattened out globally after years of expansion.  But there is good reason to believe that the harsh anti-trade rhetoric is more a function of politics than public sentiment. A Pew Research Center poll in August, for instance, found that 50% of respondents view free-trade agreements as a positive, while 42% see them as negative. That level of support is essentially where it was early in the year and down slightly from mid-2015. The same poll found that TPP was supported by 40% and opposed by 35%, with the rest unfamiliar with the deal or not having an opinion. There is also good reason to see that the economic case for trade is strong. Yes, trade creates winners and losers. And, yes, more needs to be done to retrain displaced workers and offer them educational opportunities. But the winning side is wider and deeper: Trade produces cheaper consumer products for struggling families. In most contexts, Americans would not support policies that make them pay more for something just to benefit a relative few. They certainly wouldn't tolerate tariffs on imported oil to prop up domestic energy producers. So why should they be made to pay more for cars or clothes or building supplies? Trade produces competition that spawns innovation. Who could doubt that Detroit creates vastly better products now than it did in the 1970s, when imports were a relatively insignificant part of the domestic auto market? Trade produces export-related jobs. Many of the job losses blamed on commerce agreements are actually the result of technology that allows more goods to be manufactured with fewer workers. While it is true that trade and automation have been brutal on certain types of jobs, trade has had a brighter side as well. The United States exports $2.3 trillion in goods and services each year, producing 11.3 million jobs. These export-related jobs tend to be higher skilled and better paying than the ones eliminated. Many of them are in high tech, pharmaceuticals and financial services. And, in fact, access to world markets has allowed companies such as Apple and Microsoft to become iconic global brands. Exports have also come from some surprising areas. In 2014, for instance, Honda became the first Japanese car maker to become a net exporter from the United States. The remorselessly protectionist rhetoric on the campaign trail, including Trump's over-the-top attacks on NAFTA and Clinton's flip-flop on TPP, appeals to voters in Rust Belt battleground states. But it does not reflect the broader economic reality that robust trade helps an innovative, ambitious nation like the United States far more than it hurts. 
January 18, 2017	USA TODAY	Chinese online shopping giant Alibaba announced Monday it has formed a coalition that will leverage the power of big data to crack down on purveyors of fake goods, whose value in 2015 exceeded $1.7 trillion, according to the International Anti-Counterfeiting Coalition.  U.S. companies suffer most at the hand of brand pirates, with one-in-five knockoffs infringing on American products, and 63% of counterfeit goods come from China, according to the Organization for Economic Cooperation and Development. The mission of the Alibaba Big Data Anti-Counterfeiting Alliance, whose 20 members include luxury brands such as Louis Vuitton and Swarovski, is to pool information, data and expertise in intellectual property authentication with the ultimate goal of "helping block, screen and take down infringing listings," according to a statement from Alibaba. "The most powerful weapon against counterfeiting today is data and analytics, and the only way we can win this war is to unite," said Jessie Zheng, Chief Platform Governance Officer of Alibaba Group. Alibaba, which sells 14.5 billion items a year to Amazon's 5 billion according to courier ParcelHero, has been aggressive about using data analytics to put counterfeiters out of business. Its software currently scans 10million product listings a day. In the 12 months ending last August, the company closed down 180,000 third-party stores for trafficking in fake items. During that same period, Alibaba provided sufficient information to brands and law enforcement agencies to close 675 counterfeit goods manufacturing operations, the company said. According to the OECD's 2016 report, "Trade in Counterfeit and Pirated Goods: Mapping the Economic Impact," brands most affected by counterfeiters include Rolex, Ray-Ban, Louis Vuitton and Nike. In fact, footwear tops the categories, followed by clothing, leather goods and electrical equipment. Alibaba's executive chairman, Jack Ma, recently traveled to New York City's Trump Tower to meet with President-elect Donald Trump. Ma has pledged to create 1 million U.S. jobs by growing trade between small U.S. businesses and Chinese consumers. Amazon recently announced plans to create 100,000 U.S. jobs over the next 18 months. Most of the positions will be at fulfillment centers, including new facilities under construction in California, Florida, New Jersey and Texas. The new employees will also work in areas such as cloud technology, machine learning, and advanced logistics. 
November 16, 2016	USA TODAY	It is a testament to Donald Trump's political skills that his supporters were never deterred by his  excesses and reversals. Trump explainers say the experts missed this moment because they demanded specificity and facts from the president-elect in a way his devotees did not. "The press takes him literally, but not seriously; his supporters take him seriously, but not literally," Salena Zito wrote in The Atlantic. Though Trump supporters might possess a remarkable capacity to suspend disbelief, the rest of the world will not be so forgiving. As the commander in chief of the armed forces and guarantor of the post-war geopolitical order, every statement out of Trump's mouth will be taken quite literally by both America's allies and adversaries.  The foundation of deterrence is a clear and unequivocal understanding of what interests a nation will fight to defend. Vagueness in the realm of statecraft leads revisionist powers to test their parameters and, in so doing, risk overreaching and miscalculation. That's how wars start. We don't have to go diving into the deepest recesses of history to support the contention that U.S. presidents must say what they mean and mean what they say. President Obama drew a red line over the prospect of Syrian President Bashar Assad deploying chemical weapons against civilians, but Obama's bluff was called and the world saw him blink. The following years were typified by aggressive nations testing Washington's commitment to defending the status quo. Not since World War II has a European power invaded and summarily annexed neighboring territory, but that's what an emboldened Russian President Vladimir Putin did in 2014. This brazen test of the Western powers that had guaranteed Ukrainian territorial integrity occurred only after Obama leaned on Moscow to save him from himself by negotiating the surrender of Assad's chemical stockpiles. In the end, Assad maintained and still uses his chemical weapons. Beijing, too, watched Obama back off his red line. When he took office, Obama dedicated himself to reorienting U.S. diplomatic and military posture toward the Asia Pacific. The "pivot to Asia" seemed forever on the horizon and, by 2014, was not yet manifest in the form of appreciably more U.S. naval hardware in the region. Assured of American timidity, China created territory from whole cloth in the contested South China Sea, turning man-made islands into fortresses dedicated to power projection. Obama was generally prudent about the language he used when he knew that the world was listening. Yet the president's moment of incaution made for a more dangerous world. What will be the effect of a far less circumspect president tripping over his words on a more regular basis? Trump has already given the West's adversaries cause to test him. When The New York Times asked whether he'd come to the aid of Estonia, Latvia or Lithuania in the event of a Russian incursion, Trump refused to say and added: "We have many NATO members that aren't paying their bills." Yet NATO's mutual defense provisions require such a military response, and in any case Estonia is one of five NATO member states that met its 2015 requirement to spend the equivalent of 2% of GDP on defense. This is a signal to Russia's expansionist president, who will surely take advantage of what he perceives to be new latitude. China is frequently the subject of Trump's tough talk, but no state would so benefit from America's retreat from its financial obligations. The likely death of the 12-member Trans-Pacific Partnership may lead to regional trade pacts that privilege Chinese and Japanese markets and don't impose U.S. standards on them. Anticipating Trump's promised "trade war" with China, the Pacific is pivoting unto itself. Trump also has said that South Korea and Japan might need their own nuclear weapons to protect themselves, because America can't afford it anymore. It's only smart for Asia to prepare for a post-American future. In the cold, hard power logic of geopolitics, history hangs on the American president's every word. Being coy or offhand about U.S. security priorities can lead to the kind of miscalculations that have the potential to devolve into cascading cycles of proportionately escalating retaliation. Absent cooler heads, those cycles can spiral out of control. A president does not have the luxury of imprecise language. Trump's fans may not take his words seriously, but America's enemies most certainly will.
