March 18, 2016	USA TODAY	Easing the big Bentley Bentayga away from the curb, you realize rather quickly that this SUV will be unlike any you've ever driven. Next you notice amazing power. For that, we thank the 6-liter, 12-cylinder engine -- one of the last of its gas-guzzling breed.  Love it or resent it as you may, just being in the Bentley is a rare pleasure. A chance to spend some road time in a Bentayga is akin to being accidentally locked in a Tiffany store -- an SUV fit for a Trump. It's not often that we get to take a spin in a $270,000 vehicle, including options, of any sort. Even at Bentayga's base price of $229,100, you could buy a bevy of conventional U.S. midmarket SUVs for the same outlay -- one for every day of the week. Bentayga is among the first among a new breed of super-luxury SUVs. Maserati is giving the American introduction to its new Levante SUV next week at the New York Auto Show. Rolls-Royce has its own, the Cullinan, on the way. Bentayga is filled with little delights. Note how the seats have 16-way power adjustments -- both front and back. Or how little water jets emerge from the otherwise flush front end to squirt grime off the headlights in stormy weather. It's a pleasure to drive. That amazing suspension, my seatmate from Bentley assures me, comes from a high-power computerized system that makes constant adjustments for any surface. Because it's an SUV and off-road capable, Bentayga also has a system that raises and lowers the front and rear ends to provide extra wheel clearance for tearing over sand dunes or thrashing through the snow. The process is helped along by controls on the center console that allow drivers to switch the car's terrain mode. There's also comfort, sport and other settings for regular driving. They not only stiffen or loosen the cushiness of the suspension but determine how hard it is to turn the  wheel. Bentayga's monster engine is good for 600 horsepower. It can catapult itself from zero to 60 mph in four seconds. Top speed is 187 mph. The engine, like many these days, shuts off at intersections to save fuel. And it has the ability to shut off 6 cylinders when they are not needed. Bentley boasts that it is 10.2% more fuel efficient than its existing 12-cylinder engine, which, in other Bentley models, averages 15 miles a gallon.  Bentayga's mileage rating is yet to be released for the U.S. A gas-electric hybrid option will follow. Self-driving? Sort of. The Bentley has adaptive cruise control, so it can track cars in front of it, and does a pretty good job of keeping itself centered in a lane. The interior is, as you might expect, sumptuous. Our test car was finished in a shiny "piano black" trim. With no wood grain showing, any material could have done the job. But Bentley assures that it is, yes, real wood. For the moment, Bentayga is available only as a two-row SUV. A three-row version is next. In back, Bentley has poured a lot of attention into creating options for the cargo bay. The version we tested had a nifty pull-out seat that fits over the tailgate. Our favorite option for the back would have to be the "Integrated Milliner Hamper Set," which comes with a mini-fridge, "fine Linley china cutlery" and crystal glassware. Basically, it's a picnic set straight from Downton Abbey. There are 17 stock paint colors, but the custom list takes the hues up to 90, though Americans generally will take what they see in a showroom. Bentley expects to sell about 5,000 Bentaygas a year when deliveries start by early June, about a third of them in the U.S.
July 22, 2016	USA TODAY	Completing his historic drive to the Republican presidential nomination, Donald Trump told a divided Republican Party on Thursday that he will be the "voice" for frustrated Americans who have been let down by government and the "elites" who run it. "Nobody knows the system better than me, which is why I alone can fix it," Trump told a fired-up crowd of backers that packed the downtown Quicken Loans Arena.  After ascending the stage to the theme from the action film Air Force One, Trump said he "humbly and gratefully" accepted the Republican nomination to the presidency, then launched into a prepared teleprompter speech peppered with caustic asides about career politicians. In addition to promoting his own qualifications for the White House, Trump's speech was aimed at uniting a convention in which the runner-up in the primary campaign refused to endorse him, critical delegates staged a noisy floor fight over the rules, and a string of high-profile Republicans boycotted the entire event. Trump argued that the United States is in decline under the Obama administration, citing a litany of grim statistics about crime and violence, terrorism and national security, and the rising number of Americans who have stopped looking for work. Election opponent Hillary Clinton and other Democrats are to blame for many of the nation's ills, Trump said, and the problems of poverty, violence and war "will last only as long as we continue relying on the same politicians who created them." Hitting the former secretary of State for foreign policy problems ranging from Libya to the rise of the Islamic State, Trump said Clinton's legacy is one of "death, destruction, terrorism and weakness." Citing the recent spate of police killings and terrorism, the businessman who has never held public office promised that "the crime and violence that today afflicts our nation will soon, and I mean very soon, come to an end." Echoing promises he has made since hitting the campaign trail 13 months ago, Trump said he will stop illegal immigration with a wall along the U.S.-Mexico border and change trade agreements that he claims have sucked manufacturing jobs out of the United States to foreign countries. He again blasted what he called the unfair trade tactics of competitors like China. While Trump in past months has proposed a temporary ban on Muslims entering the United States, he said Thursday that the suspension would apply only to migrants "from any nation that has been comprised by terrorism." Throughout the day, the Clinton campaign and other Democratic groups sent out statements denouncing various Trump policies as ineffectual, divisive or simply wrong-headed and accused him of distorting Clinton's records. They also cited Republican infighting over Trump, including the refusal of many high-profile Republicans to endorse the party's new standard-bearer. In his hour-plus remarks, Trump recited a string of slogans he used at rallies across the country in the past year, including "Law and Order," "America First," a "rigged system," and -- the original campaign theme -- "Make America Great Again." The crowd responded with repeated ovations and chants like "build that wall!" and "U-S-A!" Trump himself occasionally joined in the "U-S-A" chants, flashing the crowd a thumbs-up. Mocking the pro-Clinton slogan -- "I'm With Her" -- Trump told delegates: "I'm with you, the American people: I am your voice." And as in previous rallies, Trump had to pause at one point as a protester heckled him and had to be removed by security. As Trump put the final touches on his speech and did a walk-though of the stage set-up Thursday, he took to Twitter to proclaim the convention a success. "Other than a small group of people who have suffered massive and embarrassing losses, the party is VERY united," Trump tweeted. "Great love in the arena!" Daughter Ivanka Trump introduced her father to the noisy crowd that packed Cleveland's basketball arena, telling them he is a "fighter" who became "the people's nominee." Ahead of Trump's big night a flap arose over his commitment to U.S. military alliances, including NATO. When The New York Times asked the candidate about the prospect of a Russian attack on NATO allies in the Baltic States, Trump said he would authorize help only after deciding whether those countries "have fulfilled their obligations to us." Republicans who have questioned Trump's grasp of foreign policy reacted with indignation. Sen. Lindsey Graham, R-S.C., said Trump "is essentially telling Russians/other bad actors" that the United States "is not fully committed to supporting NATO alliance." Trump's convention ends a day after ex-primary rival Sen. Ted Cruz of Texas refused to endorse the party's nominee during his convention speech, inciting a chorus of boos from pro-Trump delegates. At a meeting of the Texas delegation Thursday, Cruz noted Trump has criticized his wife's looks and all but accused his dad of participating in a plot to assassinate President John F. Kennedy. "I wasn't going to come like a servile puppy dog and say 'Thank you very much' for maligning my wife and father," Cruz said. 
December 7, 2016	USA TODAY	When Donald Trump accepted a phone call from Taiwan's president, he signaled to China that he is prepared not only to break with longtime U.S. policy but also to launch U.S.-Chinese relations on a more confrontational course. The conversation with President Tsai Ing-wen was the first by a U.S. president or president-elect since 1979, when Jimmy Carter ended official relations with Taiwan after recognizing Beijing's communist government as the only representative of China. Beijing considers Taiwan a breakaway province that it plans someday to unify with the mainland.  Beyond upsetting Beijing with his call, Trump has accused China of unfair trade and exerting new military muscle in Asia. Trump's conversation with Taiwan's democratically elected president is too important for China's communist leaders to ignore, said Michael Auslin, author of the soon-to-be published book The End of the Asian Century. China's "One China" policy is "all about separatism," Auslin said. If Taiwan can move toward independence, as many on the island want, then so can Tibet and Xinjiang, he said of Tibetan- and Muslim-majority regions in China with separatist movements. China can show its displeasure with the United States in areas such as economics, anti-terrorism and North Korea's nuclear program, said Cheng Li, director of the China program at the Brookings Institution, a Washington think-tank. China can ratchet up military activities in the South China Sea, where the United States seeks to maintain freedom of navigation for commercial and  Navy ships. China's neighbors resist its territorial claims, as well. Bonnie Glaser, a China expert at the Center for Strategic and International Studies in Washington, said Trump's advisers are trying "to show China that things won't be conducted business as usual. ... Trump seems to have bought into this." After his phone call with Taiwan's leader, Trump tweeted, "Did China ask us if it was OK to devalue their currency (making it hard for our companies to compete), heavily tax our products going into ... their country (the U.S. doesn't tax them) or to build a massive military complex in the middle of the South China Sea? I don't think so!" Trump's tweet links separate areas of conflict with China in a new way, but China can play that game, too. In the South China Sea, China has built islands on atolls and rocks and added hardened aircraft hangars and shipping piers. U.S. allies in the area have protested, and the United States has used its ships and military aircraft to enforce free access for all. "Until now, (the Chinese) have said these aren't military bases," Auslin said. "To show Trump he's going down the wrong road, I wouldn't be surprised if they say these are bases and base fighter planes on them." China could deploy radar and anti-ship and anti-aircraft missiles, demand that foreign aircraft and vessels identify themselves in the area and bar access to military craft and ships from the USA and other nations. "Are these small countries going to risk an encounter with Chinese fighter jets?" Auslin said. "It makes China the regional (superpower) and forces the U.S. to decide whether they're going to challenge China." China signed on to international sanctions imposed by the United Nations Security Council last week in response to North Korea's nuclear weapons tests, but it could walk away from them, Auslin said. It could boost economic and military aid to North Korea, an ally wholly dependent on China, and declare an end to international talks to end the North's nuclear program. "They could use it as a stick to beat Trump with," Auslin said. Trump could respond by ramping up pressure with more sanctions on Chinese companies that support North Korea and its nuclear activities. President Obama issued the first such sanctions in September. "Trump could do more," Glaser said. Trump says China dumps steel and other imports at low prices to put competitors out of business, violates intellectual property rights and manipulates its currency to lower the cost of its products and make U.S. goods more expensive in China. This is one area where the Chinese "are more vulnerable than we are," Auslin said. "We can find other markets. They are less able to find other markets the size of the USA." Trump has threatened to declare China a currency manipulator. That determination could result in tariffs on Chinese imports and a trade war, Auslin said. China's economy would suffer, and the cost of goods would go up for U.S. consumers. China could respond by refusing to buy U.S. Treasury bonds. That would hike U.S. government borrowing costs, raise interest rates on U.S. consumers and businesses and spook the stock market. University of Maryland economist Phillip Swagel sees a trade war and a currency war with China on the horizon because China's currency will continue to fall, while Trump's plan to cut taxes and increase spending will make the dollar stronger. Swagel said that would open opportunities for Trump to expand trade elsewhere in Asia. "I wonder if the China bashing produces gains in other places," he said. "He could portray it as shoring up Japan against China." 
June 22, 2016	USA TODAY	Hillary Clinton painted Donald Trump's ideas and temperament as a dangerous combination that could lead to another recession, in a swing-state speech extending her critique of the presumptive GOP nominee's fitness to serve as president. "Just as he shouldn't have his finger on the button, he shouldn't have his hands on our economy," Clinton told nearly 300 people in a speech in Columbus, Ohio, on Tuesday. Despite his success as a businessman, Trump "would throw us back into recession," the presumptive Democratic nominee said.  Trump's pugnacious personality is one lens through which Clinton's campaign is building its case against the real estate mogul. In her speech Tuesday -- heavy with "and I quote" references to Trump's words -- Clinton rebutted idea after idea Trump has proposed, seeking to show his business experience doesn't translate to strong proposals for the country's economy. Trump would wipe out post-crash rules on banks, give sweeping tax cuts that could widen deficits, cancel trade deals and deport immigrants in the USA without documentation, leading to uncertainty and economic disaster, Clinton said. "The full faith and credit of the United States is not something we just gamble away," she said. "The United States of America doesn't do business Trump's way. And it matters when a presidential candidate talks like this, because the world hangs on every word our president says. ... Someone should tell him our nation's economy isn't a game." Much like in a recent speech in San Diego in which Clinton deemed Trump "temperamentally unfit" to lead the nation in foreign affairs, she warned that Trump's policies and leadership approach would pose a danger to American economic security. Trump's campaign responded to Clinton in a barrage of emails and tweets, unusual in their resemblance to typical campaign "opposition" from aides. "Hillary Clinton surged the trade deficit with China 40% as Secretary of State, costing Americans millions of jobs," Trump said in one tweet. The billionaire's policies would grow jobs by lifting regulations on businesses and energy production and by enforcing penalties for other countries' currency manipulation and intellectual property theft, his campaign said in an email. Another email quoted from a book by a former Secret Service agent, calling Clinton "volcanic, impulsive, enabled by sycophants, and disdainful of the rules set for everyone else." Clinton attacked Trump for having a predilection for playing with debt, warning he would bankrupt the country like he did his casinos in Atlantic City. A trail of thousands of lawsuits, including those involving his defunct Trump University and others involving unpaid bills, show that Trump makes "over-the-top promises" to people that fall apart, she said. "People get hurt," Clinton said. "He's written a lot of books about business. They all seem to end at Chapter 11." In a tweet, Trump countered he would approach the U.S. economy differently than he approached his business. "I am 'the king of debt,'" he tweeted. "That has been great for me as a businessman, but is bad for the country. I made a fortune off of debt, will fix U.S." Clinton first previewed Tuesday's approach in an interview last week with USA TODAY. Her senior adviser, Jake Sullivan, echoed those themes in a statement Monday night. "Everything that applies to Trump about national security is equally true when it comes to the economy," Sullivan said. "If we were to put Donald Trump behind the wheel of the American economy, he would very likely drive us off a cliff and working families would bear the brunt of the impact in terms of lost jobs, lost savings and lost livelihoods," Sullivan said. He pointed to a new report from Moody's Analytics finding that the economy "will be significantly weaker" if Trump's economic proposals were to be adopted. The report predicted stagnant incomes, a "lengthy recession" and stock and real house value declines. Clinton will outline her own economic vision in a separate speech Wednesday in Raleigh, N.C. according to the campaign. The presumptive Democratic nominee blasted Trump on Tuesday for not releasing his tax returns. "You have to ask yourself, what's he afraid of?" Clinton said. "Maybe he isn't as rich as he claims." Clinton suggested Trump might not have paid much in taxes or might not have given much money to charity. Clinton stated her economic case against Trump in Ohio, the quintessential swing state. A poll Tuesday morning showed her tied with the real estate mogul in a two-way Ohio race: Each candidate got 40%. Clinton trailed Trump by 4 points in the same poll a month earlier. Part of the survey was conducted before the Orlando shooting. Some Ohio Republicans have been slow to support Trump, who lost to Ohio Gov. John Kasich in the state's GOP primary.
January 24, 2017	USA TODAY	The clock's ticking on Donald Trump's first 100 days in office, and if the post-election stock market rally is to continue, the nation's 45th president must now make good on promises to enact policies that will make it easier for U.S. companies to profit and prosper and American workers to better share in the prosperity, investors say. "He has to start delivering," says Randy Frederick, vice president of trading and derivatives at the Schwab Center for Financial Research. "How much time the market will give him amid the high expectations, I don't know."  The 6.2% gain in the Standard & Poor's 500 stock index from Election Day to Trump's inauguration Friday -- the fourth-best  rally for a president-elect -- was driven largely by speculation about Trump's promise to slash the federal tax rate for U.S. companies and to push for deregulation to boost corporate profitability. Monday, Trump met with top CEOs at the White House, reiterating his "America First"  blueprint and sending a clear message that boosting the U.S. economy is a top priority. Trump said he plans to "cut taxes massively" for corporations and the middle class and pare back business regulations "by 75% and maybe more." But when it comes to the stock market, which is moving into more of a "show-me" mode, Trump's promises of things to come carries less weight now. Investors have become more skeptical as to how much of Trump's agenda will come to fruition. Those concerns are reflected in the stalling out of the "Trump rally." The S&P 500 has slipped roughly 1% since its Jan. 6 record close and has posted losses the past two weeks. The index was down 0.4% Monday despite Trump's latest promises. "The market got ahead of itself with all the Trump euphoria," says Jerry Braakman, chief investment officer at First America Trust. Now, Wall Street wants to see details about how big a tax cut corporations will actually get. Trump said Monday he sees the corporate tax rate, now 35%, falling to 15% to 20%, which is lower than a plan laid out by fellow Republicans. Investors want to know how big an infrastructure bill Trump can get passed and how quickly. Wall Street also wants more details on what types of changes Trump is seeking from his plans to renegotiate the North American Free Trade Agreement, or NAFTA, which Trump says has resulted in U.S. jobs fleeing to Mexico and Canada. A big question is whether Trump's main focus is what Wall Street perceives as his more market-friendly plans, such as lowering taxes, bolstering fiscal spending and paring back regulations on businesses while keeping consumer protections in place, says Michael Arone, chief investment strategist at State Street Global Advisors. Or the more bearish Trump policies, such as imposing border taxes on imports to the U.S., and other moves perceived as anti-free trade, such as branding China a "currency manipulator." "If they get tax reform, fiscal spending and repatriation of foreign profits done, it will be good for the market," Arone says. "But if Trump ... labels China a currency manipulator, or talks about trade restrictions and tariffs that could prove problematic for the U.S. and the global economy, that would give me pause." 
December 8, 2016	USA TODAY	President-elect Donald Trump nominated Iowa's governor to be ambassador to China, picked a retired general to be his secretary of Homeland Security, and tapped Oklahoma's attorney general for the Environmental Protection Agency, officials said Wednesday.  Trump also said Wednesday he will nominate Linda McMahon -- co-founder of the WWE pro wrestling empire -- to be the leader of his Small Business Administration. Trump  will return to the campaign trail, aides said, weighing in on the Louisiana U.S. Senate race by appearing at a campaign rally Friday in Baton Rouge. Trump later confirmed plans to nominate Iowa Gov. Terry Branstad as the U.S. ambassador to China, a nation Trump has been feuding with in recent days. In a statement, Trump said Branstad "successfully developed close trade ties with China while serving as chief executive of the Hawkeye State." Branstad, who called Chinese President Xi Jinping "an old friend," said in a statement that he looks forward to "building on our long friendship to cultivate and strengthen the relationship between our two countries and to benefit our economy." Another major appointment in the offing: retired Marine Corps general John Kelly for the department of Homeland Security, according to a person close to the transition speaking on condition of anonymity pending a formal announcement. Trump's job interviews Wednesday included a second round with Oklahoma Attorney General Scott Pruitt, who will be nominated to administrator of the Environmental Protection Agency -- an agency he has sued. As a state official, Pruitt has taken the Obama administration to court over a variety of environmental and other regulations. "Mr. Pruitt led Oklahoma's legal challenges to the EPA, Obamacare, executive actions on illegal immigration, Dodd-Frank and President Obama's repeated attempts to bypass Congress," transition spokesman Jason Miller said. "Attorney General Pruitt has a strong conservative record as a state prosecutor and has demonstrated a familiarity with laws and regulations impacting a large energy resource state." Environmental groups already are lining up against Pruitt, noting that he is supporter of fracking despite its link to a rise of earthquakes in Oklahoma. Gene Karpinski, president of the League of Conservation Voters, said that "Scott Pruitt running the EPA is like the fox guarding the henhouse. Time and again, he has fought to pad the profits of Big Polluters at the expense of public health." Miller also said Trump will attend a  rally Friday in Baton Rouge on behalf of Louisiana Senate candidate John Kennedy. The spokesman said that Trump wants "another Republican vote in the United States Senate." The president-elect said he continues to consider 2012 Republican presidential nominee Mitt Romney for secretary of State, and he rejected suggestions that he is stringing out the process in order to mock Romney. "No, it's not about revenge," Trump told NBC. "It's about what's good for the country. And I'm able to put this stuff behind us." 
